post_id,post_title,comment_id,author,body,score,created_utc
1jioony,BUY EVERYTHING,mjgvild,firewoodrack,I got Uber Eats last night and a fairly new Lexus GX460 pulled up ![img](emote|t5_2th52|4271)![img](emote|t5_2th52|4271),4889,1742819881.0
1jioony,BUY EVERYTHING,mjgp5rr,JoseArcadi0, Pics of the driver or didn’t happen.,3611,1742817119.0
1jioony,BUY EVERYTHING,mjgosvc,HighOrHavingAStroke,"The attractive blonde girls start driving ubers on the way down, long before the bottom.",2306,1742816954.0
1jioony,BUY EVERYTHING,mjgq9xn,Pitiful-Recover-3747,"If people still got uber money, it ain’t the bottom.",8054,1742817624.0
1jioony,BUY EVERYTHING,mjgpzrp,Gh0StDawGG,Heard my building maintenance guy explaining options to a random in my lobby the other day. Are we really at the bottom?,2254,1742817499.0
1jioony,BUY EVERYTHING,mjh3ha4,AC_deucey,"https://preview.redd.it/hua50bh33nqe1.jpeg?width=1393&format=pjpg&auto=webp&s=b46c6d92550831d9aa208b1154637a7c55b823c5

I’m from the future. ![img](emote|t5_2th52|4267)",466,1742822903.0
1jioony,BUY EVERYTHING,mjgqe1y,TheProfessional9,Didn't the RL version of this guy just say this is the beginning of the downturn?,407,1742817675.0
1jioony,BUY EVERYTHING,mjgrj0q,Pin_ups,You forgot to say she owns 3 homes with zero down payment at the current premiums of 5k each per month and she makes one third of that expense.,367,1742818185.0
1jioony,BUY EVERYTHING,mjh4h5j,,[removed],752,1742823259.0
1jioony,BUY EVERYTHING,mjh0679,,[removed],719,1742821694.0
1jioony,BUY EVERYTHING,mjgtey1,D1ckChowder,Can’t wait to pay for my uber with Klarna or Affirm,150,1742819005.0
1jioony,BUY EVERYTHING,mjhgopn,strangebru,"A comedian in the 1980s had a joke similar to this:


> The best part of the recession is that the prostitutes are getting better looking.",136,1742827230.0
1jioony,BUY EVERYTHING,mjh672s,bucketdaruckus,"No joke I tried to sign up for doordash, ubereats, instacart and amazonflex like 2 days ago and they're all full not accepting new drivers in my area",187,1742823856.0
1jioony,BUY EVERYTHING,mjgseth,EasilyDistracted-,"Was the Uber driver delivering a burrito someone bought on a payment plan?

We haven't begun to scrape bottom yet.",119,1742818572.0
1jioony,BUY EVERYTHING,mjgqh8g,solidtangent,AI killing OF.,101,1742817714.0
1jioony,BUY EVERYTHING,mjgwxkq,mrbombastically,Save the tattoed girls for me,-1,1742820451.0
1jioony,BUY EVERYTHING,mjgy9y4,IgnobleSpleen,Tattoos are unattractive? What year is it?,-6,1742820974.0
1jioony,BUY EVERYTHING,mjgw4y1,obamnamamna,Tattoos unattractive?  I get the meme but like what type of religious fundamentalist purity logic shit is that? Lmao,-8,1742820133.0
1jioony,BUY EVERYTHING,mjgrk9u,pgm3387,Plot twist: she has a dic,-5,1742818200.0
1jioony,BUY EVERYTHING,mjgwz65,ToEuropa,Nah she probably fresh off the boat Eastern Europe,-1,1742820468.0
1jioony,BUY EVERYTHING,mjhcahq,learnedsanity,"some people are literally doing this line of work to have that nice car, which seems like a weird choice but that's just my look on life.",1415,1742825825.0
1jioony,BUY EVERYTHING,mjh6jil,OneArmedBrain,"It's something I've noticed as well.  I don't use that service, or DD, but living in an apartment complex, I see a lot of them and yes I've notice nicer cars and more ""professional"" people doing deliveries recently.",730,1742823975.0
1jioony,BUY EVERYTHING,mjgrar1,SevereArrivals13,"Feet pics if possible for additional verification

Disclaimer: Its just for security reasons and nothing else",1360,1742818082.0
1jioony,BUY EVERYTHING,mjh523j,BetElectronic6207,"If you go to Germany or even Canada you can see hot girls working jobs that you almost never see them working in the US. I imagine the phenomenon is even more pronounced in Eastern Europe, but I haven’t been. I think maybe the US is unique in hot girls refusing to debase themselves with menial labor.",124,1742823464.0
1jioony,BUY EVERYTHING,mjgq5yk,Neowwwwww,Just means only fans is taking a hit from ai porn.,1032,1742817575.0
1jioony,BUY EVERYTHING,mjgscvu,mrdeadsniper,"Yeah this guy is huffing intense copium. 

If this is the start of a recession, its the first month. If recessions only lasted a month people wouldn't be so concerned with them. 

Markets like stability, and we are no where near that right now. 

There is very real concerns we will go into stagflation period due to self imposed tariffs and their counters. In the last two 70s and early 80s. Unemployment hit around 10% each time. 

Basically.. if you think <5% unemployment is the worst it can get.. you are going to have a bad time.",239,1742818549.0
1jioony,BUY EVERYTHING,mjgt6va,Skybreakeresq,My dude they are financing pizzas now,2487,1742818909.0
1jioony,BUY EVERYTHING,mjgreh4,SevereArrivals13,There is still a couple nickels left to steal from retail for sure lol,1064,1742818129.0
1jioony,BUY EVERYTHING,mjgsudn,Narradisall,"In 2008 people were writing suicides notes and some were following through on it. It can get so much worse and given this sub is still somewhat buoyant I don’t think we’re at capitulation yet, if we ever get there this time.",328,1742818761.0
1jioony,BUY EVERYTHING,mjgsr0d,normalbrain609,If there's a real deal bad recession watching Zoomers understand what a bad economy actually looks like is gonna be wild.,151,1742818720.0
1jioony,BUY EVERYTHING,mjgqfq4,MilkyWayObserver,Depends did he say to get calls or puts?,710,1742817695.0
1jioony,BUY EVERYTHING,mjgs0l9,Warren_Puff-it,"I believe he said ""I will have the gabagool.""",406,1742818400.0
1jioony,BUY EVERYTHING,mjgwzci,shiningbeans,"Damn you didn’t have to Doxx her, now we know she’s in Miami",154,1742820471.0
1jioony,BUY EVERYTHING,mjh50ky,Donthavethekey,"Five is way too young to invest in the market, don’t worry about it ",112,1742823449.0
1jioony,BUY EVERYTHING,mji21u2,bloob_appropriate123,"Exactly, part of the pleasure in using hookers is knowing that they're doing it out of desperation.",-23,1742833666.0
1jioony,BUY EVERYTHING,mjhcjsg,notoriouslush,Oh that ain't good,116,1742825909.0
1jioony,BUY EVERYTHING,mjh4ydl,Cygs,"OF is so oversaturated the median revenue is like 5/mo for models.  Amouranth is buying and selling mansions, sure.  Your average OF thot is working hours a week to buy half a big mac.


Its like saying ""The soundest financial move is to play basketball, Kevin Durant makes 50 million a year"".  ",161,1742823428.0
1jioony,BUY EVERYTHING,mjgpubu,Live_Key2247,"I’m guessing when an attractive woman starts driving for uber it’s an indication that she isn’t financially stable and needs quick cash, which in itself indicates we might be in an economic recession. Kinda grasping at straws here",180,1742817430.0
1jioony,BUY EVERYTHING,mjgt1ey,Mysterious_Print9937,Daddy chill,114,1742818845.0
1jioony,BUY EVERYTHING,mjhbahi,damnmyredditheart,Tattoos are hot tbh ,-7,1742825502.0
1jioony,BUY EVERYTHING,mjiysdf,shmoculus,"They are an amplifier and signify non-conformity, if you're a loser or ugly they make you look worse, if you are hot or successful they make you look better",-2,1742843044.0
1jioony,BUY EVERYTHING,mjhi0b9,Academic-Ad8382,"What happens is they over extend themselves and then rationalize doing that line of work for that nice car.

If a person has forsight to know that they would need to work a second job for a nice car, they *probably* have enough executive functioning to maybe not get that nice car.",668,1742827647.0
1jioony,BUY EVERYTHING,mjhki7c,klausbaudelaire1,I’ve seen it too. Saw a young girl delivering Uber Eats to my apartment complex in a very “mid” part of my mid city. She was driving a NICE BMW. ,128,1742828423.0
1jioony,BUY EVERYTHING,mjhqt7u,ProdMikalJones,money is money,279,1742830322.0
1jioony,BUY EVERYTHING,mjgs6l7,Shakaww,2Feet verification,912,1742818472.0
1jioony,BUY EVERYTHING,mjhdilo,Don_Cornichon_II,"I think it's just that the US has fewer hot girls, since 90% are obese.",302,1742826218.0
1jioony,BUY EVERYTHING,mjgzu0t,Ashamed-Fig-4680,It would be hilarious if AI droid brothels started popping up and it killed the porn industry in the future 😂,365,1742821568.0
1jioony,BUY EVERYTHING,mjgvg5q,Brodie_C,"We have an entire generation of people trading the market now, who were literal babies the last time we had a serious recession.",133,1742819853.0
1jioony,BUY EVERYTHING,mjgsqvi,redditmodloservirgin,You honestly believe the lines that we haven't been in a recession for the past 2 years?,-23,1742818718.0
1jioony,BUY EVERYTHING,mjgux8c,MaxPower303,I need a co-signer for my large two topping pizza from Domino’s at 29.99% APR.,1117,1742819638.0
1jioony,BUY EVERYTHING,mjgyf1q,Pitiful-Recover-3747,"Exactly. If there’s banks willing to extend credit on pizza, we ain’t at the bottom.",144,1742821028.0
1jioony,BUY EVERYTHING,mjgxjp0,iamprobablytalkingbs,"It will trickle eventually, I swear",316,1742820694.0
1jioony,BUY EVERYTHING,mjgt68k,zg44,"That's 17 years ago.

We got a whole generation of ""traders"" and people <30 years old that have no real clue of what a serious recession is.",370,1742818902.0
1jioony,BUY EVERYTHING,mjhztk7,bloob_appropriate123,">landlordfucks4cash


Yikes I didn't know this existed. Men really do hate us.",-1,1742833001.0
1jioony,BUY EVERYTHING,mjgz5uu,Much-Bedroom86,"The problem with that is things suck now for a lot of them already. At least previous recessions were preceded by boom times. 2008 was preceded by cheap houses plus a tech boom. Late 2010's saw more tech jobs and cheap housing. Especially if you bought in 2020. Today, entry level jobs are harder to come by and houses are more expensive than ever if you're young and single.",110,1742821312.0
1jioony,BUY EVERYTHING,mjgti7o,According_Win_5983,Pay for your uber ride over 12 months with klarna!,104,1742819044.0
1jioony,BUY EVERYTHING,mjgsr4y,Gh0StDawGG,Hard to remember because I work at Wendys and do the same to anyone who comes to my drive through. Conversations get mixed up after a while.,367,1742818722.0
1jioony,BUY EVERYTHING,mjgrcdj,SevereArrivals13,Yes,138,1742818103.0
1jioony,BUY EVERYTHING,mjgu3v2,bunchofrightsiders,He can pretend to be other characters but he's Michael Scott and that's it.,-9,1742819300.0
1jioony,BUY EVERYTHING,mjhtz7o,T8ert0t,"Yes, and Steve Buscemi volunteered on 9/11.",-2,1742831263.0
1jioony,BUY EVERYTHING,mjgq3tl,MtnMaiden,"Yup, the hot girl index.  Yes it's a thing",144,1742817549.0
1jioony,BUY EVERYTHING,mjgqgvp,Academic-Image-6097,"Right, that makes sense. But is that a better indicator than, I don't know, just a lot of people applying to jobs in the gig economy?

 Should attractive women have an easier time finding a job? Well, I guess so... But who is the guy in the picture, though?

Probably overthinking it.",-2,1742817710.0
1jioony,BUY EVERYTHING,mjgqhj9,Gortecz,But this is bullshit because we all know that attractive women will start an OnlyFans,-6,1742817718.0
1jioony,BUY EVERYTHING,mjgxjlp,obamnamamna,Bro again I get the meme. I said that. What I don't get is conflating tattoos with being unattractive. What type of baby shit is that,-3,1742820693.0
1jioony,BUY EVERYTHING,mjjwugr,twitch1982,"And from most economic studies I've seen, with driving Uber at least, dunno about eats, you're basically just making enough to cover the wear and tear and added depreciation your putting on your car. Its just a loan against the life and resale value of the vehicle, that you have to give up hours of your day for.",232,1742853010.0
1jioony,BUY EVERYTHING,mjhn9e6,WorldlyNotice,"It's not about extra money to pay for the car, it's about the car being a ""work car"" so they can get expenses, depreciation, and tax deductions out of it.

They probably use a spare room as their ""office"" for their food delivery business to deduct some percentage of taxes / interest as well.",-6,1742829260.0
1jioony,BUY EVERYTHING,mji0jdl,List-Beneficial,I won't lie. If I see an Uber driver with 50k car or 100k car I automatically think they are regarded,470,1742833215.0
1jioony,BUY EVERYTHING,mjh0952,DiasCrimson,"What if they have two left feet?

https://preview.redd.it/z869oz9rzmqe1.jpeg?width=1279&format=pjpg&auto=webp&s=e9452e305df7ad9b267040a7270e604c4dfc2656",873,1742821725.0
1jioony,BUY EVERYTHING,mji8txc,nephaelimdaura,"You don't even need to be hyperbolic like this. 73% of Americans are overweight or obese, 42% are obese. If you are a straight, normal weight American and looking for a normal weight partner, you are already only looking at 1/8 of the population before even accounting for anything else like age",177,1742835632.0
1jioony,BUY EVERYTHING,mjh046c,Neowwwwww,"It will, 100% guarantee.",191,1742821674.0
1jioony,BUY EVERYTHING,mjgwyvg,Complex_Confidence35,Yeah but we got like 0.0001% of the wealth. It doesn‘t matter if everyone under 30 goes broke. The market doesn‘t care about poor people.,114,1742820465.0
1jioony,BUY EVERYTHING,mjgvf0u,fritz_76,im gonna need you to hold the pepperoni in escrow,467,1742819840.0
1jioony,BUY EVERYTHING,mjh0ixo,Banes_Addiction,"Yeah, that's the ""stripper with 5 mortgages"" stage.",126,1742821825.0
1jioony,BUY EVERYTHING,mjha4t4,Kind_Move2521,"People will always need buds and why pay $250 for a zip from a solo grower with top-tier buds that works their ass off to produce the highest-quality ganja when you could get some dried-too-fast, non-cured, '29%' shit from a dispensary for $100 plus tax.

Recreational legalization has over-saturated and killed the market for small growers. If your response is, 'wElL tHat HaSNt hApPened In mY AreA' then you havent seen what's coming yet.",-4,1742825124.0
1jioony,BUY EVERYTHING,mjgymyx,Mooseandchicken,Does our economy have an enlarged prostate? Cuz that's usually the culprit if you're barely gettin a trickle,128,1742821112.0
1jioony,BUY EVERYTHING,mjgy57c,AggravatingWealth69,Me playing halo 3 while my dad navigates thru a financial crisis ![img](emote|t5_2th52|8883),260,1742820924.0
1jioony,BUY EVERYTHING,mjgu8v9,Narradisall,"What are you talking about it was only a few yea… oh god, oh no!",156,1742819357.0
1jioony,BUY EVERYTHING,mjgvhyq,Vospader998,"But not so long ago that all the people who caused it are still around, and didn't learn a goddamn thing other than ""I can fuck up as much as I want, and the taxpayers will bail me out"". 

Pump the economy for all it's worth, make a fortune, then dump everything once it all falls apart. Pump-and-dump to get yours while the pensions, 401ks, life savings, and taxpayers are left holding the bag.",103,1742819874.0
1jioony,BUY EVERYTHING,mjgwt7k,dysfunctionalbrat,"""Sir, isn't this a Wendy's?""",109,1742820403.0
1jioony,BUY EVERYTHING,mji6g3s,Whorq_guii,Ask women.,-2,1742834954.0
1jioony,BUY EVERYTHING,mjkm3xz,primusperegrinus,So you’re saying it’s best to do uber eats in a stolen car?,212,1742860882.0
1jioony,BUY EVERYTHING,mjqmuw6,atv223,I’d rather own a 4Runner,-1,1742942993.0
1jioony,BUY EVERYTHING,mji2wf4,KexRwondo,Or they have no life,122,1742833917.0
1jioony,BUY EVERYTHING,mji6hsr,ProdMikalJones,"I’m just looking at it from a stand point of: 

You & I have no idea the circumstances or reasoning as to why others make the money they make the way they do. 

It could be someone who dashes once or twice on the way home from work to cover a lunch bill or get some extra money for dinner, or even extra gas money.

Someone could be an independent contractor (outside of courier services) and be in between jobs for a little bit.

Others could be using multiple services when not on the other. Get off Doordash, go to Uber, then Ubereats, to Grub Hub, etc. The “50k car or 100k car” could be primarily used for Ride Sharing services that are upper end like Uber XL or so be it.

I just don’t get the judgement of people who are actively working. Who cares? There’s a demand for couriers, they are supplying it. 

Hell, that super expensive car could be a loaner or a relatives that they are borrowing.

Who’s more questionable, the person delivering food in a nice car, or the customer ordering a personal taxi for their food (plus fees, times etc.) for convenience sake and then getting weird about their driver / tipping. Pretty sure you can do payment plans on those apps now too, which is even more of a questionable act.

(Immediate downvotes is weird, Doordash was initially marketed towards people who just want to make a few extra dollars, with commuting in mind)

Thanks for the reward, that’s a first for a comment. Be good to fellow man.",176,1742834968.0
1jioony,BUY EVERYTHING,mji335h,No_Sugar8791,More likely they're using it as a cover to sell other products.,-6,1742833973.0
1jioony,BUY EVERYTHING,mjh2omk,Garchompisbestboi,"come on man, I was just about to eat dinner when I saw that 😂",221,1742822617.0
1jioony,BUY EVERYTHING,mjj368e,FeelingFae,"If 73% of Americans are overweight or obese then that is a ""normal weight"".",-24,1742844324.0
1jioony,BUY EVERYTHING,mjh0rbf,zmbjebus,Is escrow code word for up my ass? because if so then yes.,157,1742821912.0
1jioony,BUY EVERYTHING,mjgvbof,Throwaway921845,"We are closer to the 22nd century than to the end of World War Two.

By the time you and I have grey hair, World War Two will be as ancient as the Franco-Prussian War was when we were children.",116,1742819802.0
1jioony,BUY EVERYTHING,mjh01kl,obamnamamna,Couldnt even begin to tell you how wrong you are haha that's a real virgin incel style take,-5,1742821646.0
1jioony,BUY EVERYTHING,mjinhv6,Safe_Personality_772,"You are overcomplicating this. This is not to look down on people, but the fact that someone is driving Uber or Door Dash for $20/hr tells me all I need to know: they are underemployed. You would make more by putting in more time at a white collar or even many blue collar trade jobs.

Its like post Great Financial Crisis when you'd see clean shaven 40 year old corporate dudes running the kitchen at Chick-fil-a. If I see someone driving uber who is not a typical ride service driver (stereotyping here but we all know what this means) is signals a soft labor market.",109,1742839781.0
1jioony,BUY EVERYTHING,mjhhc38,generalwaste1,It's OK. You can rub one out real quick,172,1742827434.0
1jioony,BUY EVERYTHING,mjhdfgv,Ill-Region-5200,"They'll take over both porn and prostitution. Make no mistake, it is as inevitable as it is necessary. Women have had unilateral control of the sexual marketplace for the last few decades and it's time to wrest it back.",-10,1742826191.0
1jioony,BUY EVERYTHING,mjhm4xr,Illustrious-Salt-214,"as a literal prostitute I doubt that very much lmao. I’m still getting $500+ to spend an hour w chuds like you, my clients just aren’t broke incels 😘",-1,1742828923.0
1jioony,BUY EVERYTHING,mjhbj7l,19-dickety-2,"Except that real wages increased by more than inflation and the effect was concentrated in the working class:

https://www.statista.com/statistics/1351276/wage-growth-vs-inflation-us/

https://www.epi.org/publication/swa-wages-2022/

> What this report finds: Between 2019 and 2022, low-wage workers experienced historically fast real wage growth. The 10th percentile real hourly wage grew 9.0% over the three-year period.",-10,1742825580.0
1jioony,BUY EVERYTHING,mjmjr8l,Born-Interaction3,Lies.. The American and Israeli army do NOT drive Toyotas,-1,1742894002.0
1jgzmbg,Tax accountants going through 800 pages of trading activity just to see $2.32 of capital gains for their client,mj3fshe,Greenpeppers23,I purposely lose at least 3k yearly in trading to have a write off. I know genius,4896,1742615954.0
1jgzmbg,Tax accountants going through 800 pages of trading activity just to see $2.32 of capital gains for their client,mj3fog9,brunk_,"Todd I just paid you man, please get off Reddit and stop making posts about me.",1306,1742615904.0
1jgzmbg,Tax accountants going through 800 pages of trading activity just to see $2.32 of capital gains for their client,mj3itej,RememberTooSmile,"you guys are making gains?

https://preview.redd.it/8opnaj9246qe1.jpeg?width=730&format=pjpg&auto=webp&s=c6b318decfb105ff62004ce7edc8853c22c47dfe",632,1742617349.0
1jgzmbg,Tax accountants going through 800 pages of trading activity just to see $2.32 of capital gains for their client,mj3dh69,ThroatPlastic6886,wtf is a capital gain? ,1817,1742614940.0
1jgzmbg,Tax accountants going through 800 pages of trading activity just to see $2.32 of capital gains for their client,mj3dhr2,f0xinaround,Would love to hear from all the tax accountants out there who actually have to do this lol,386,1742614947.0
1jgzmbg,Tax accountants going through 800 pages of trading activity just to see $2.32 of capital gains for their client,mj3j16i,-Reggie-Dunlop-,Is the capital gain in the room with you right now?,147,1742617454.0
1jgzmbg,Tax accountants going through 800 pages of trading activity just to see $2.32 of capital gains for their client,mj3jrhf,Tangentkoala,"Lmao, trust us, we don't do that. 


We literally just plug in the 1099 tax form code that's printed out by robinhood/e trade. 

We do laugh at the loss porn that you guys have in 1 year.",126,1742617807.0
1jgzmbg,Tax accountants going through 800 pages of trading activity just to see $2.32 of capital gains for their client,mj3gk78,chicken_tenders99998,Shit comes naturally,1054,1742616304.0
1jgzmbg,Tax accountants going through 800 pages of trading activity just to see $2.32 of capital gains for their client,mj3tp75,exposed_anus,Infinite money glitch,104,1742623253.0
1jgzmbg,Tax accountants going through 800 pages of trading activity just to see $2.32 of capital gains for their client,mj3r8n5,Aniruddha_Panda,"You said you will pay me 10% of your capital gain and I believed you.

Never again.",578,1742621802.0
1jgzmbg,Tax accountants going through 800 pages of trading activity just to see $2.32 of capital gains for their client,mj3e94i,baby-shart,It’s one of the knobs on your graphic equaliser next to bass and treble.,736,1742615271.0
1jgzmbg,Tax accountants going through 800 pages of trading activity just to see $2.32 of capital gains for their client,mj3gjtr,fitnessfinance88,"Anything more than 5-10 transactions in a Schedule D we'll usually just extract the pages as a PDF, attach it to the return using the software and just enter the summarized gains of short-term, long-term categories. 90% of the time people lose money and especially if it's short-term.",272,1742616300.0
1jgzmbg,Tax accountants going through 800 pages of trading activity just to see $2.32 of capital gains for their client,mj3e6le,one_dayatatime,It’s summarized usually on the 3rd or 4th page.,230,1742615240.0
1jgzmbg,Tax accountants going through 800 pages of trading activity just to see $2.32 of capital gains for their client,mj3yo7m,DevBro22,At least for me it does lmao,173,1742626383.0
1jgzmbg,Tax accountants going through 800 pages of trading activity just to see $2.32 of capital gains for their client,mj65mco,DustyBowls,Well I don't think Trump would call it an account in his case. It's more of a career.,-1,1742662410.0
1jgzmbg,Tax accountants going through 800 pages of trading activity just to see $2.32 of capital gains for their client,mj3uctk,Moister_Rodgers,"Singular ""gain"" should've tipped you off",171,1742623655.0
1jgzmbg,Tax accountants going through 800 pages of trading activity just to see $2.32 of capital gains for their client,mj3gppj,nothingclever9873,"And it goes from +11 to -11,000",193,1742616374.0
1jgzmbg,Tax accountants going through 800 pages of trading activity just to see $2.32 of capital gains for their client,mj4uqrc,NoTransportation888,"Same here, anything more than 5-10 and I attach it lol. As a fellow degen I do love when a 200 page 1099 hits my desk though.

Usually, if it's someone with 100+ pages you get like 5-6 of them from different brokerages as well lmao",110,1742646057.0
1jgzmbg,Tax accountants going through 800 pages of trading activity just to see $2.32 of capital gains for their client,mj3eg7v,ItsSevii,Still gotta enter em all manually at least in turbo tax,-68,1742615357.0
1jgzmbg,Tax accountants going through 800 pages of trading activity just to see $2.32 of capital gains for their client,mj3esc0,culdeus,Turbo tax 1998 maybe,140,1742615506.0
1jpyz81,You know your calls are cooked when the board comes out,ml34avn,LucidMarshmellow,He also said a minimum of 10% on all that are not on the list.,8819,1743626033.0
1jpyz81,You know your calls are cooked when the board comes out,ml33z46,tbiol,I’m just wondering who picked that board up from OfficeMax,3858,1743625940.0
1jpyz81,You know your calls are cooked when the board comes out,ml35d8x,fledermaus23,It's a beautiful board. People are saying that it is the best board ever.,11386,1743626331.0
1jpyz81,You know your calls are cooked when the board comes out,ml34jsf,Unusual_Midnight_243,bro crashed the market by holding up a printed Excel table,13343,1743626103.0
1jpyz81,You know your calls are cooked when the board comes out,ml388mk,xxqr,I always thought Cambodians got off to easy. Glad to see someone finally stand up to those damn bullies.,4490,1743627126.0
1jpyz81,You know your calls are cooked when the board comes out,ml35jfh,legumeappreciator,fighting a trade war against Cambodia 🤡🤡🤡,4805,1743626379.0
1jpyz81,You know your calls are cooked when the board comes out,ml37cxt,Bowser64_,Nintendo just announced 90$ Mario and Luigi games. So trump counters with 131.40$ Mario and dead Luigi games.,3007,1743626885.0
1jpyz81,You know your calls are cooked when the board comes out,ml352ua,tees_printandapparel,"https://preview.redd.it/ebzuf4h1ghse1.jpeg?width=1170&format=pjpg&auto=webp&s=5c916f1b983455241724404bbdb81b475437b6c9

😭",3811,1743626251.0
1jpyz81,You know your calls are cooked when the board comes out,ml340xp,VanDenH,"Taiwan 32% lmao, American tech prices about to be through the roof",8943,1743625955.0
